73, Newark, New Jersey, 282090, 277140, +1.79%, 24.1, 62.4, 11691, 4514, 40°43′27″N 74°10′21″W, 40.7242°N 74.1726°W, 40.7242 -74.1726, 07101-07108  07112  07114  , 36.8808, SE, 75, True, Rain showers likely before 2pm then showers and thunderstorms likely. Cloudy. High near 75 with temperatures falling to around 72 in the afternoon. Southeast wind 8 to 12 mph. Chance of precipitation is 70%. New rainfall amounts between a tenth and quarter of an inch possible., Rain Showers Likely, 8 to 12 mph, 2019-05-28T11:00:00-04:00, 1, 2019-05-28T18:00:00-04:00, Today, falling, SW, 63, False, A chance of showers and thunderstorms before 8pm then showers and thunderstorms likely between 8pm and 10pm then a chance of showers and thunderstorms. Some of the storms could produce small hail. Mostly cloudy. Low around 63 with temperatures rising to around 65 overnight. Southwest wind around 8 mph. Chance of precipitation is 60%. New rainfall amounts between a tenth and quarter of an inch possible., Chance Showers And Thunderstorms, 8 mph, 2019-05-28T18:00:00-04:00, 2, 2019-05-29T06:00:00-04:00, Tonight, rising, NW, 77, True, A chance of showers and thunderstorms after 4pm. Partly sunny with a high near 77. Northwest wind around 9 mph. Chance of precipitation is 30%., Partly Sunny then Chance Showers And Thunderstorms, 9 mph, 2019-05-29T06:00:00-04:00, 3, 2019-05-29T18:00:00-04:00, Wednesday, None, S, 63, False, A chance of showers and thunderstorms. Mostly cloudy with a low around 63. South wind 3 to 7 mph. Chance of precipitation is 50%. New rainfall amounts between a quarter and half of an inch possible., Chance Showers And Thunderstorms, 3 to 7 mph, 2019-05-29T18:00:00-04:00, 4, 2019-05-30T06:00:00-04:00, Wednesday Night, None, SW, 82, True, A slight chance of rain showers. Mostly cloudy. High near 82 with temperatures falling to around 74 in the afternoon. Southwest wind 5 to 9 mph. Chance of precipitation is 20%. New rainfall amounts less than a tenth of an inch possible., Slight Chance Rain Showers, 5 to 9 mph, 2019-05-30T06:00:00-04:00, 5, 2019-05-30T18:00:00-04:00, Thursday, falling, SW, 62, False, A slight chance of rain showers before 8pm then showers and thunderstorms likely. Mostly cloudy with a low around 62. Chance of precipitation is 60%. New rainfall amounts between a quarter and half of an inch possible., Showers And Thunderstorms Likely, 5 to 12 mph, 2019-05-30T18:00:00-04:00, 6, 2019-05-31T06:00:00-04:00, Thursday Night, None, NW, 79, True, Mostly sunny with a high near 79., Mostly Sunny, 9 to 14 mph, 2019-05-31T06:00:00-04:00, 7, 2019-05-31T18:00:00-04:00, Friday, None, N, 59, False, Mostly clear with a low around 59., Mostly Clear, 3 to 9 mph, 2019-05-31T18:00:00-04:00, 8, 2019-06-01T06:00:00-04:00, Friday Night, None, SE, 80, True, A slight chance of showers and thunderstorms after 4pm. Sunny with a high near 80., Sunny then Slight Chance Showers And Thunderstorms, 3 to 9 mph, 2019-06-01T06:00:00-04:00, 9, 2019-06-01T18:00:00-04:00, Saturday, None, SW, 64, False, A slight chance of showers and thunderstorms. Partly cloudy with a low around 64., Slight Chance Showers And Thunderstorms, 8 mph, 2019-06-01T18:00:00-04:00, 10, 2019-06-02T06:00:00-04:00, Saturday Night, None, W, 82, True, A chance of showers and thunderstorms. Partly sunny with a high near 82. Chance of precipitation is 40%., Chance Showers And Thunderstorms, 8 mph, 2019-06-02T06:00:00-04:00, 11, 2019-06-02T18:00:00-04:00, Sunday, None, NW, 58, False, A chance of showers and thunderstorms. Mostly cloudy with a low around 58. Chance of precipitation is 30%., Chance Showers And Thunderstorms, 8 mph, 2019-06-02T18:00:00-04:00, 12, 2019-06-03T06:00:00-04:00, Sunday Night, None, N, 75, True, A slight chance of rain showers. Partly sunny with a high near 75., Slight Chance Rain Showers, 9 mph, 2019-06-03T06:00:00-04:00, 13, 2019-06-03T18:00:00-04:00, Monday, None
74, Toledo, Ohio, 274975, 287208, −4.26%, 80.7, 209.0, 3451, 1332, 41°39′51″N 83°34′55″W, 41.6641°N 83.5819°W, 41.6641 -83.5819,   Zip codes   43601  43603-43615  43617  43620  43623  43635  43652  43654  43656-43657  43659-43661  43666-43667  43681-43682  43697  43699  , 182.88, W, 83, True, A slight chance of showers and thunderstorms. Partly sunny with a high near 83. West wind around 16 mph with gusts as high as 30 mph. Chance of precipitation is 20%. New rainfall amounts less than a tenth of an inch possible., Slight Chance Showers And Thunderstorms, 16 mph, 2019-05-28T11:00:00-04:00, 1, 2019-05-28T18:00:00-04:00, Today, None, N, 58, False, A chance of showers and thunderstorms after midnight. Mostly cloudy with a low around 58. North wind 5 to 14 mph. Chance of precipitation is 40%. New rainfall amounts between a tenth and quarter of an inch possible., Mostly Cloudy then Chance Showers And Thunderstorms, 5 to 14 mph, 2019-05-28T18:00:00-04:00, 2, 2019-05-29T06:00:00-04:00, Tonight, None, E, 68, True, A chance of showers and thunderstorms. Cloudy with a high near 68. East wind around 7 mph. Chance of precipitation is 50%. New rainfall amounts between a quarter and half of an inch possible., Chance Showers And Thunderstorms, 7 mph, 2019-05-29T06:00:00-04:00, 3, 2019-05-29T18:00:00-04:00, Wednesday, None, NE, 58, False, A chance of showers and thunderstorms. Mostly cloudy with a low around 58. Northeast wind 2 to 6 mph. Chance of precipitation is 40%. New rainfall amounts less than a tenth of an inch possible., Chance Showers And Thunderstorms, 2 to 6 mph, 2019-05-29T18:00:00-04:00, 4, 2019-05-30T06:00:00-04:00, Wednesday Night, None, SE, 69, True, Showers and thunderstorms likely. Cloudy with a high near 69. Southeast wind 1 to 5 mph. Chance of precipitation is 70%. New rainfall amounts between a half and three quarters of an inch possible., Showers And Thunderstorms Likely, 1 to 5 mph, 2019-05-30T06:00:00-04:00, 5, 2019-05-30T18:00:00-04:00, Thursday, None, NW, 53, False, A chance of showers and thunderstorms before midnight. Mostly cloudy with a low around 53. Chance of precipitation is 40%. New rainfall amounts between a quarter and half of an inch possible., Chance Showers And Thunderstorms then Mostly Cloudy, 5 to 9 mph, 2019-05-30T18:00:00-04:00, 6, 2019-05-31T06:00:00-04:00, Thursday Night, None, NE, 71, True, Sunny with a high near 71., Sunny, 1 to 5 mph, 2019-05-31T06:00:00-04:00, 7, 2019-05-31T18:00:00-04:00, Friday, None, W, 54, False, Mostly clear with a low around 54., Mostly Clear, 2 mph, 2019-05-31T18:00:00-04:00, 8, 2019-06-01T06:00:00-04:00, Friday Night, None, SW, 73, True, A chance of showers and thunderstorms after noon. Mostly sunny with a high near 73. Chance of precipitation is 50%., Mostly Sunny then Chance Showers And Thunderstorms, 2 to 7 mph, 2019-06-01T06:00:00-04:00, 9, 2019-06-01T18:00:00-04:00, Saturday, None, W, 55, False, A chance of showers and thunderstorms. Mostly cloudy with a low around 55. Chance of precipitation is 50%., Chance Showers And Thunderstorms, 2 to 7 mph, 2019-06-01T18:00:00-04:00, 10, 2019-06-02T06:00:00-04:00, Saturday Night, None, N, 69, True, A chance of rain showers before 1pm. Mostly sunny with a high near 69. Chance of precipitation is 40%., Chance Rain Showers, 5 mph, 2019-06-02T06:00:00-04:00, 11, 2019-06-02T18:00:00-04:00, Sunday, None, N, 51, False, Mostly clear with a low around 51., Mostly Clear, 3 mph, 2019-06-02T18:00:00-04:00, 12, 2019-06-03T06:00:00-04:00, Sunday Night, None, W, 70, True, Sunny with a high near 70., Sunny, 1 to 5 mph, 2019-06-03T06:00:00-04:00, 13, 2019-06-03T18:00:00-04:00, Monday, None
75, Durham, North Carolina, 274291, 228330, +20.13%, 109.8, 284.4, 2395, 925, 35°58′52″N 78°54′10″W, 35.9811°N 78.9029°W, 35.9811 -78.9029, 27701  27702  27703  27704  27705  27706  27707  27708  27709  27710  27711  27712  27713  27715  27717  27722, 121.92, SW, 96, True, Sunny with a high near 96. Southwest wind around 8 mph., Sunny, 8 mph, 2019-05-28T11:00:00-04:00, 1, 2019-05-28T18:00:00-04:00, Today, None, W, 71, False, Mostly clear with a low around 71. West wind 2 to 8 mph., Mostly Clear, 2 to 8 mph, 2019-05-28T18:00:00-04:00, 2, 2019-05-29T06:00:00-04:00, Tonight, None, W, 95, True, Sunny with a high near 95. West wind 2 to 9 mph with gusts as high as 18 mph., Sunny, 2 to 9 mph, 2019-05-29T06:00:00-04:00, 3, 2019-05-29T18:00:00-04:00, Wednesday, None, SW, 71, False, Partly cloudy with a low around 71. Southwest wind 2 to 8 mph., Partly Cloudy, 2 to 8 mph, 2019-05-29T18:00:00-04:00, 4, 2019-05-30T06:00:00-04:00, Wednesday Night, None, SW, 97, True, Mostly sunny with a high near 97. Southwest wind 2 to 10 mph., Mostly Sunny, 2 to 10 mph, 2019-05-30T06:00:00-04:00, 5, 2019-05-30T18:00:00-04:00, Thursday, None, SW, 71, False, Partly cloudy with a low around 71., Partly Cloudy, 3 to 8 mph, 2019-05-30T18:00:00-04:00, 6, 2019-05-31T06:00:00-04:00, Thursday Night, None, W, 90, True, Mostly sunny with a high near 90., Mostly Sunny, 5 mph, 2019-05-31T06:00:00-04:00, 7, 2019-05-31T18:00:00-04:00, Friday, None, N, 67, False, A slight chance of showers and thunderstorms after 8pm. Mostly cloudy with a low around 67., Slight Chance Showers And Thunderstorms, 2 mph, 2019-05-31T18:00:00-04:00, 8, 2019-06-01T06:00:00-04:00, Friday Night, None, N, 87, True, A chance of showers and thunderstorms. Mostly sunny with a high near 87. Chance of precipitation is 40%., Chance Showers And Thunderstorms, 3 mph, 2019-06-01T06:00:00-04:00, 9, 2019-06-01T18:00:00-04:00, Saturday, None, NW, 66, False, A chance of showers and thunderstorms. Partly cloudy with a low around 66. Chance of precipitation is 40%., Chance Showers And Thunderstorms, 3 mph, 2019-06-01T18:00:00-04:00, 10, 2019-06-02T06:00:00-04:00, Saturday Night, None, W, 88, True, A slight chance of showers and thunderstorms. Mostly sunny with a high near 88., Slight Chance Showers And Thunderstorms, 1 to 5 mph, 2019-06-02T06:00:00-04:00, 11, 2019-06-02T18:00:00-04:00, Sunday, None, W, 66, False, A slight chance of showers and thunderstorms. Partly cloudy with a low around 66., Slight Chance Showers And Thunderstorms, 5 mph, 2019-06-02T18:00:00-04:00, 12, 2019-06-03T06:00:00-04:00, Sunday Night, None, N, 85, True, A slight chance of showers and thunderstorms before 8am. Mostly sunny with a high near 85., Slight Chance Showers And Thunderstorms then Mostly Sunny, 5 mph, 2019-06-03T06:00:00-04:00, 13, 2019-06-03T18:00:00-04:00, Monday, None
76, Chula Vista, California, 271651, 243916, +11.37%, 49.6, 128.5, 5387, 2080, 32°37′40″N 117°00′55″W, 32.6277°N 117.0152°W, 32.6277 -117.0152, 91909–91915  91921, 120.0912, SW, 67, True, Mostly sunny with a high near 67. Southwest wind 0 to 10 mph., Mostly Sunny, 0 to 10 mph, 2019-05-28T08:00:00-07:00, 1, 2019-05-28T18:00:00-07:00, Today, None, SW, 56, False, Mostly cloudy with a low around 56. Southwest wind 0 to 5 mph., Mostly Cloudy, 0 to 5 mph, 2019-05-28T18:00:00-07:00, 2, 2019-05-29T06:00:00-07:00, Tonight, None, SW, 68, True, Partly sunny with a high near 68. Southwest wind 0 to 10 mph., Partly Sunny, 0 to 10 mph, 2019-05-29T06:00:00-07:00, 3, 2019-05-29T18:00:00-07:00, Wednesday, None, SW, 57, False, Mostly cloudy with a low around 57. Southwest wind 0 to 5 mph., Mostly Cloudy, 0 to 5 mph, 2019-05-29T18:00:00-07:00, 4, 2019-05-30T06:00:00-07:00, Wednesday Night, None, W, 69, True, Mostly sunny with a high near 69. West wind 0 to 10 mph., Mostly Sunny, 0 to 10 mph, 2019-05-30T06:00:00-07:00, 5, 2019-05-30T18:00:00-07:00, Thursday, None, W, 57, False, Mostly cloudy with a low around 57., Mostly Cloudy, 0 to 5 mph, 2019-05-30T18:00:00-07:00, 6, 2019-05-31T06:00:00-07:00, Thursday Night, None, W, 68, True, Partly sunny with a high near 68., Partly Sunny, 0 to 10 mph, 2019-05-31T06:00:00-07:00, 7, 2019-05-31T18:00:00-07:00, Friday, None, W, 57, False, Mostly cloudy with a low around 57., Mostly Cloudy, 0 to 10 mph, 2019-05-31T18:00:00-07:00, 8, 2019-06-01T06:00:00-07:00, Friday Night, None, W, 68, True, Partly sunny with a high near 68., Partly Sunny, 0 to 10 mph, 2019-06-01T06:00:00-07:00, 9, 2019-06-01T18:00:00-07:00, Saturday, None, W, 57, False, Mostly cloudy with a low around 57., Mostly Cloudy, 0 to 10 mph, 2019-06-01T18:00:00-07:00, 10, 2019-06-02T06:00:00-07:00, Saturday Night, None, W, 69, True, Mostly sunny with a high near 69., Mostly Sunny, 0 to 10 mph, 2019-06-02T06:00:00-07:00, 11, 2019-06-02T18:00:00-07:00, Sunday, None, W, 57, False, Partly cloudy with a low around 57., Partly Cloudy, 5 to 10 mph, 2019-06-02T18:00:00-07:00, 12, 2019-06-03T06:00:00-07:00, Sunday Night, None, W, 70, True, Mostly sunny with a high near 70., Mostly Sunny, 5 to 10 mph, 2019-06-03T06:00:00-07:00, 13, 2019-06-03T18:00:00-07:00, Monday, None
77, Fort Wayne, Indiana, 267633, 253691, +5.50%, 110.6, 286.5, 2391, 923, 41°05′18″N 85°08′38″W, 41.0882°N 85.1439°W, 41.0882 -85.1439,   ZIP codes  46774  46802–46809  46814–46816  46818  46819  46825  46835  46845  , 0, W, 79, True, A chance of showers and thunderstorms. Mostly cloudy with a high near 79. West wind 10 to 15 mph with gusts as high as 25 mph. Chance of precipitation is 40%., Chance Showers And Thunderstorms, 10 to 15 mph, 2019-05-28T11:00:00-04:00, 1, 2019-05-28T18:00:00-04:00, Today, None, N, 59, False, A chance of showers and thunderstorms. Mostly cloudy with a low around 59. North wind 5 to 10 mph. Chance of precipitation is 50%. New rainfall amounts between a quarter and half of an inch possible., Chance Showers And Thunderstorms, 5 to 10 mph, 2019-05-28T18:00:00-04:00, 2, 2019-05-29T06:00:00-04:00, Tonight, None, S, 77, True, A chance of showers and thunderstorms. Cloudy with a high near 77. South wind 0 to 10 mph. Chance of precipitation is 50%. New rainfall amounts between a quarter and half of an inch possible., Chance Showers And Thunderstorms, 0 to 10 mph, 2019-05-29T06:00:00-04:00, 3, 2019-05-29T18:00:00-04:00, Wednesday, None, SW, 63, False, A chance of showers and thunderstorms. Mostly cloudy with a low around 63. Southwest wind 0 to 5 mph. Chance of precipitation is 50%. New rainfall amounts between a tenth and quarter of an inch possible., Chance Showers And Thunderstorms, 0 to 5 mph, 2019-05-29T18:00:00-04:00, 4, 2019-05-30T06:00:00-04:00, Wednesday Night, None, N, 70, True, A chance of showers and thunderstorms before 8am then showers and thunderstorms likely between 8am and 2pm then showers and thunderstorms likely. Cloudy with a high near 70. North wind 0 to 10 mph. Chance of precipitation is 70%. New rainfall amounts between a half and three quarters of an inch possible., Chance Showers And Thunderstorms then Showers And Thunderstorms Likely, 0 to 10 mph, 2019-05-30T06:00:00-04:00, 5, 2019-05-30T18:00:00-04:00, Thursday, None, NW, 53, False, Showers and thunderstorms likely before 2am. Mostly cloudy with a low around 53. Chance of precipitation is 60%. New rainfall amounts between a tenth and quarter of an inch possible., Showers And Thunderstorms Likely, 5 to 10 mph, 2019-05-30T18:00:00-04:00, 6, 2019-05-31T06:00:00-04:00, Thursday Night, None, NW, 72, True, Mostly sunny with a high near 72., Mostly Sunny, 5 mph, 2019-05-31T06:00:00-04:00, 7, 2019-05-31T18:00:00-04:00, Friday, None, SW, 54, False, Partly cloudy with a low around 54., Partly Cloudy, 5 mph, 2019-05-31T18:00:00-04:00, 8, 2019-06-01T06:00:00-04:00, Friday Night, None, W, 75, True, A chance of showers and thunderstorms after 8am. Mostly sunny with a high near 75. Chance of precipitation is 40%., Chance Showers And Thunderstorms, 5 to 10 mph, 2019-06-01T06:00:00-04:00, 9, 2019-06-01T18:00:00-04:00, Saturday, None, NW, 55, False, A chance of showers and thunderstorms. Mostly cloudy with a low around 55. Chance of precipitation is 40%., Chance Showers And Thunderstorms, 5 to 10 mph, 2019-06-01T18:00:00-04:00, 10, 2019-06-02T06:00:00-04:00, Saturday Night, None, N, 71, True, A slight chance of showers and thunderstorms before 2pm. Partly sunny with a high near 71., Slight Chance Showers And Thunderstorms, 5 to 10 mph, 2019-06-02T06:00:00-04:00, 11, 2019-06-02T18:00:00-04:00, Sunday, None, N, 51, False, Partly cloudy with a low around 51., Partly Cloudy, 5 to 10 mph, 2019-06-02T18:00:00-04:00, 12, 2019-06-03T06:00:00-04:00, Sunday Night, None, NW, 71, True, Sunny with a high near 71., Sunny, 5 mph, 2019-06-03T06:00:00-04:00, 13, 2019-06-03T18:00:00-04:00, Monday, None
78, Jersey City, New Jersey, 265549, 247597, +7.25%, 14.8, 38.3, 17848, 6891, 40°42′41″N 74°03′53″W, 40.7114°N 74.0648°W, 40.7114 -74.0648, 07097  07302-07308  07310-07311 , 25.908, SE, 73, True, Rain showers likely before 2pm then showers and thunderstorms likely. Cloudy. High near 73 with temperatures falling to around 70 in the afternoon. Southeast wind 9 to 13 mph. Chance of precipitation is 70%. New rainfall amounts between a tenth and quarter of an inch possible., Rain Showers Likely, 9 to 13 mph, 2019-05-28T11:00:00-04:00, 1, 2019-05-28T18:00:00-04:00, Today, falling, SW, 63, False, Showers and thunderstorms likely before 10pm then a chance of showers and thunderstorms. Some of the storms could produce small hail. Mostly cloudy with a low around 63. Southwest wind around 8 mph. Chance of precipitation is 60%. New rainfall amounts between a tenth and quarter of an inch possible., Showers And Thunderstorms Likely then Chance Showers And Thunderstorms, 8 mph, 2019-05-28T18:00:00-04:00, 2, 2019-05-29T06:00:00-04:00, Tonight, None, NW, 76, True, A chance of showers and thunderstorms after 4pm. Partly sunny. High near 76 with temperatures falling to around 74 in the afternoon. Northwest wind around 9 mph. Chance of precipitation is 30%., Partly Sunny then Chance Showers And Thunderstorms, 9 mph, 2019-05-29T06:00:00-04:00, 3, 2019-05-29T18:00:00-04:00, Wednesday, falling, S, 62, False, A chance of showers and thunderstorms. Mostly cloudy with a low around 62. South wind 3 to 8 mph. Chance of precipitation is 50%. New rainfall amounts between a quarter and half of an inch possible., Chance Showers And Thunderstorms, 3 to 8 mph, 2019-05-29T18:00:00-04:00, 4, 2019-05-30T06:00:00-04:00, Wednesday Night, None, SW, 81, True, A slight chance of rain showers before 4pm then a chance of showers and thunderstorms. Mostly cloudy. High near 81 with temperatures falling to around 73 in the afternoon. Southwest wind 3 to 9 mph. Chance of precipitation is 30%. New rainfall amounts less than a tenth of an inch possible., Chance Showers And Thunderstorms, 3 to 9 mph, 2019-05-30T06:00:00-04:00, 5, 2019-05-30T18:00:00-04:00, Thursday, falling, SW, 62, False, Showers and thunderstorms likely. Mostly cloudy with a low around 62. Chance of precipitation is 60%. New rainfall amounts between a quarter and half of an inch possible., Showers And Thunderstorms Likely, 6 to 12 mph, 2019-05-30T18:00:00-04:00, 6, 2019-05-31T06:00:00-04:00, Thursday Night, None, NW, 79, True, Mostly sunny with a high near 79., Mostly Sunny, 9 to 14 mph, 2019-05-31T06:00:00-04:00, 7, 2019-05-31T18:00:00-04:00, Friday, None, N, 60, False, Mostly clear with a low around 60., Mostly Clear, 5 to 9 mph, 2019-05-31T18:00:00-04:00, 8, 2019-06-01T06:00:00-04:00, Friday Night, None, SE, 79, True, A slight chance of showers and thunderstorms after 4pm. Sunny with a high near 79., Sunny then Slight Chance Showers And Thunderstorms, 3 to 9 mph, 2019-06-01T06:00:00-04:00, 9, 2019-06-01T18:00:00-04:00, Saturday, None, SW, 63, False, A slight chance of showers and thunderstorms. Partly cloudy with a low around 63., Slight Chance Showers And Thunderstorms, 9 mph, 2019-06-01T18:00:00-04:00, 10, 2019-06-02T06:00:00-04:00, Saturday Night, None, SW, 81, True, A chance of showers and thunderstorms. Partly sunny with a high near 81. Chance of precipitation is 40%., Chance Showers And Thunderstorms, 9 mph, 2019-06-02T06:00:00-04:00, 11, 2019-06-02T18:00:00-04:00, Sunday, None, NW, 58, False, A chance of showers and thunderstorms. Mostly cloudy with a low around 58. Chance of precipitation is 30%., Chance Showers And Thunderstorms, 9 mph, 2019-06-02T18:00:00-04:00, 12, 2019-06-03T06:00:00-04:00, Sunday Night, None, N, 75, True, A slight chance of rain showers. Partly sunny with a high near 75., Slight Chance Rain Showers, 10 mph, 2019-06-03T06:00:00-04:00, 13, 2019-06-03T18:00:00-04:00, Monday, None
79, St. Petersburg, Florida, 265098, 244769, +8.31%, 61.8, 160.1, 4223, 1631, 27°45′43″N 82°38′39″W, 27.7620°N 82.6441°W, 27.7620 -82.6441, 33701  33702  33703  33704  33705  33710  33712-33713  33715 , 7.010400000000001, SSE, 94, True, Sunny with a high near 94. Heat index values as high as 98. South southeast wind 3 to 7 mph., Sunny, 3 to 7 mph, 2019-05-28T11:00:00-04:00, 1, 2019-05-28T18:00:00-04:00, Today, None, ENE, 75, False, Mostly clear with a low around 75. Heat index values as high as 97. East northeast wind 6 to 9 mph., Mostly Clear, 6 to 9 mph, 2019-05-28T18:00:00-04:00, 2, 2019-05-29T06:00:00-04:00, Tonight, None, SSW, 93, True, Sunny with a high near 93. South southwest wind 5 to 8 mph., Sunny, 5 to 8 mph, 2019-05-29T06:00:00-04:00, 3, 2019-05-29T18:00:00-04:00, Wednesday, None, W, 76, False, Mostly clear with a low around 76. West wind 3 to 7 mph., Mostly Clear, 3 to 7 mph, 2019-05-29T18:00:00-04:00, 4, 2019-05-30T06:00:00-04:00, Wednesday Night, None, SSW, 92, True, Sunny with a high near 92. South southwest wind around 8 mph., Sunny, 8 mph, 2019-05-30T06:00:00-04:00, 5, 2019-05-30T18:00:00-04:00, Thursday, None, SW, 77, False, Isolated showers and thunderstorms after 2am. Mostly clear with a low around 77. Southwest wind 2 to 8 mph. Chance of precipitation is 20%., Mostly Clear then Isolated Showers And Thunderstorms, 2 to 8 mph, 2019-05-30T18:00:00-04:00, 6, 2019-05-31T06:00:00-04:00, Thursday Night, None, SSW, 92, True, Isolated showers and thunderstorms. Sunny with a high near 92. South southwest wind 2 to 9 mph. Chance of precipitation is 20%., Isolated Showers And Thunderstorms, 2 to 9 mph, 2019-05-31T06:00:00-04:00, 7, 2019-05-31T18:00:00-04:00, Friday, None, NW, 78, False, Isolated showers and thunderstorms before 8pm. Mostly clear with a low around 78. Northwest wind 2 to 9 mph. Chance of precipitation is 20%., Isolated Showers And Thunderstorms then Mostly Clear, 2 to 9 mph, 2019-05-31T18:00:00-04:00, 8, 2019-06-01T06:00:00-04:00, Friday Night, None, W, 91, True, Isolated showers and thunderstorms after 2pm. Mostly sunny with a high near 91. West wind 2 to 9 mph. Chance of precipitation is 20%., Mostly Sunny then Isolated Showers And Thunderstorms, 2 to 9 mph, 2019-06-01T06:00:00-04:00, 9, 2019-06-01T18:00:00-04:00, Saturday, None, NW, 78, False, Isolated showers and thunderstorms before 8pm. Mostly clear with a low around 78. Chance of precipitation is 20%., Isolated Showers And Thunderstorms then Mostly Clear, 2 to 9 mph, 2019-06-01T18:00:00-04:00, 10, 2019-06-02T06:00:00-04:00, Saturday Night, None, WNW, 91, True, Sunny with a high near 91., Sunny, 2 to 9 mph, 2019-06-02T06:00:00-04:00, 11, 2019-06-02T18:00:00-04:00, Sunday, None, WNW, 77, False, Mostly clear with a low around 77., Mostly Clear, 3 to 9 mph, 2019-06-02T18:00:00-04:00, 12, 2019-06-03T06:00:00-04:00, Sunday Night, None, W, 91, True, Sunny with a high near 91., Sunny, 3 to 9 mph, 2019-06-03T06:00:00-04:00, 13, 2019-06-03T18:00:00-04:00, Monday, None
