234, Richardson, Texas, 120981, 99223, +21.93%, 28.6, 74.1, 3963, 1530, 32°58′20″N 96°42′29″W, 32.9723°N 96.7081°W, 32.9723 -96.7081, 75080-75083  75085, 192.024, S, 88, True, Cloudy with a high near 88. South wind around 15 mph with gusts as high as 25 mph., Cloudy, 15 mph, 2019-05-28T10:00:00-05:00, 1, 2019-05-28T18:00:00-05:00, Today, None, S, 75, False, A slight chance of showers and thunderstorms after 7pm. Mostly cloudy with a low around 75. South wind 10 to 15 mph with gusts as high as 25 mph. Chance of precipitation is 20%., Slight Chance Showers And Thunderstorms, 10 to 15 mph, 2019-05-28T18:00:00-05:00, 2, 2019-05-29T06:00:00-05:00, Tonight, None, S, 86, True, Showers and thunderstorms likely. Some of the storms could produce heavy rain. Cloudy. High near 86 with temperatures falling to around 82 in the afternoon. South wind around 15 mph with gusts as high as 25 mph. Chance of precipitation is 70%. New rainfall amounts between 1 and 2 inches possible., Showers And Thunderstorms Likely, 15 mph, 2019-05-29T06:00:00-05:00, 3, 2019-05-29T18:00:00-05:00, Wednesday, falling, SSE, 68, False, Showers and thunderstorms. Some of the storms could produce heavy rain. Cloudy with a low around 68. South southeast wind 5 to 15 mph. Chance of precipitation is 80%., Showers And Thunderstorms, 5 to 15 mph, 2019-05-29T18:00:00-05:00, 4, 2019-05-30T06:00:00-05:00, Wednesday Night, None, N, 86, True, Showers and thunderstorms likely before 7am. Partly sunny with a high near 86. North wind around 5 mph. Chance of precipitation is 60%., Showers And Thunderstorms Likely then Partly Sunny, 5 mph, 2019-05-30T06:00:00-05:00, 5, 2019-05-30T18:00:00-05:00, Thursday, None, ENE, 69, False, A chance of showers and thunderstorms after 7pm. Partly cloudy with a low around 69. East northeast wind around 5 mph. Chance of precipitation is 30%., Chance Showers And Thunderstorms, 5 mph, 2019-05-30T18:00:00-05:00, 6, 2019-05-31T06:00:00-05:00, Thursday Night, None, ENE, 87, True, A chance of showers and thunderstorms. Partly sunny with a high near 87. East northeast wind around 5 mph. Chance of precipitation is 40%., Chance Showers And Thunderstorms, 5 mph, 2019-05-31T06:00:00-05:00, 7, 2019-05-31T18:00:00-05:00, Friday, None, E, 69, False, A chance of showers and thunderstorms before 7pm. Partly cloudy with a low around 69. East wind around 5 mph. Chance of precipitation is 40%., Chance Showers And Thunderstorms then Partly Cloudy, 5 mph, 2019-05-31T18:00:00-05:00, 8, 2019-06-01T06:00:00-05:00, Friday Night, None, SE, 90, True, A chance of showers and thunderstorms after 7am. Mostly sunny with a high near 90. Southeast wind around 5 mph. Chance of precipitation is 40%., Chance Showers And Thunderstorms, 5 mph, 2019-06-01T06:00:00-05:00, 9, 2019-06-01T18:00:00-05:00, Saturday, None, SSE, 73, False, A chance of showers and thunderstorms. Partly cloudy with a low around 73. Chance of precipitation is 40%., Chance Showers And Thunderstorms, 5 mph, 2019-06-01T18:00:00-05:00, 10, 2019-06-02T06:00:00-05:00, Saturday Night, None, S, 91, True, A chance of showers and thunderstorms. Partly sunny with a high near 91. Chance of precipitation is 40%., Chance Showers And Thunderstorms, 5 mph, 2019-06-02T06:00:00-05:00, 11, 2019-06-02T18:00:00-05:00, Sunday, None, SSE, 74, False, A chance of showers and thunderstorms. Mostly cloudy with a low around 74. Chance of precipitation is 40%., Chance Showers And Thunderstorms, 5 mph, 2019-06-02T18:00:00-05:00, 12, 2019-06-03T06:00:00-05:00, Sunday Night, None, S, 90, True, A chance of showers and thunderstorms. Partly sunny with a high near 90. Chance of precipitation is 30%., Chance Showers And Thunderstorms, 5 to 10 mph, 2019-06-03T06:00:00-05:00, 13, 2019-06-03T18:00:00-05:00, Monday, None
235, Odessa, Texas, 120568, 99940, +20.64%, 45.2, 117.1, 2608, 1007, 31°53′02″N 102°20′28″W, 31.8838°N 102.3411°W, 31.8838 -102.3411, 79760-69, 879.9576000000001, W, 92, True, Sunny with a high near 92. West wind around 15 mph., Sunny, 15 mph, 2019-05-28T10:00:00-05:00, 1, 2019-05-28T18:00:00-05:00, Today, None, W, 66, False, A chance of showers and thunderstorms after 7pm. Mostly clear with a low around 66. West wind 5 to 15 mph. Chance of precipitation is 50%. New rainfall amounts between a quarter and half of an inch possible., Chance Showers And Thunderstorms, 5 to 15 mph, 2019-05-28T18:00:00-05:00, 2, 2019-05-29T06:00:00-05:00, Tonight, None, S, 84, True, A chance of showers and thunderstorms. Mostly sunny with a high near 84. South wind 5 to 15 mph. Chance of precipitation is 50%. New rainfall amounts between a quarter and half of an inch possible., Chance Showers And Thunderstorms, 5 to 15 mph, 2019-05-29T06:00:00-05:00, 3, 2019-05-29T18:00:00-05:00, Wednesday, None, NE, 57, False, A chance of showers and thunderstorms before 7pm. Partly cloudy with a low around 57. Northeast wind 5 to 15 mph. Chance of precipitation is 50%., Chance Showers And Thunderstorms then Partly Cloudy, 5 to 15 mph, 2019-05-29T18:00:00-05:00, 4, 2019-05-30T06:00:00-05:00, Wednesday Night, None, E, 83, True, A chance of showers and thunderstorms after 7am. Mostly sunny with a high near 83. East wind 5 to 15 mph. Chance of precipitation is 30%., Chance Showers And Thunderstorms, 5 to 15 mph, 2019-05-30T06:00:00-05:00, 5, 2019-05-30T18:00:00-05:00, Thursday, None, E, 63, False, A chance of showers and thunderstorms. Mostly cloudy with a low around 63. Chance of precipitation is 50%., Chance Showers And Thunderstorms, 5 to 15 mph, 2019-05-30T18:00:00-05:00, 6, 2019-05-31T06:00:00-05:00, Thursday Night, None, SE, 83, True, A chance of showers and thunderstorms. Partly sunny with a high near 83. Chance of precipitation is 50%., Chance Showers And Thunderstorms, 5 to 10 mph, 2019-05-31T06:00:00-05:00, 7, 2019-05-31T18:00:00-05:00, Friday, None, SE, 66, False, A chance of showers and thunderstorms. Mostly cloudy with a low around 66., Chance Showers And Thunderstorms, 5 to 10 mph, 2019-05-31T18:00:00-05:00, 8, 2019-06-01T06:00:00-05:00, Friday Night, None, SE, 87, True, A chance of showers and thunderstorms. Partly sunny with a high near 87., Chance Showers And Thunderstorms, 5 to 15 mph, 2019-06-01T06:00:00-05:00, 9, 2019-06-01T18:00:00-05:00, Saturday, None, SE, 68, False, A chance of showers and thunderstorms. Mostly cloudy with a low around 68., Chance Showers And Thunderstorms, 5 to 15 mph, 2019-06-01T18:00:00-05:00, 10, 2019-06-02T06:00:00-05:00, Saturday Night, None, SE, 89, True, A chance of showers and thunderstorms. Partly sunny with a high near 89., Chance Showers And Thunderstorms, 5 to 15 mph, 2019-06-02T06:00:00-05:00, 11, 2019-06-02T18:00:00-05:00, Sunday, None, SE, 69, False, A slight chance of showers and thunderstorms. Mostly cloudy with a low around 69., Slight Chance Showers And Thunderstorms, 10 to 15 mph, 2019-06-02T18:00:00-05:00, 12, 2019-06-03T06:00:00-05:00, Sunday Night, None, S, 89, True, A slight chance of showers and thunderstorms. Partly sunny with a high near 89., Slight Chance Showers And Thunderstorms, 10 to 15 mph, 2019-06-03T06:00:00-05:00, 13, 2019-06-03T18:00:00-05:00, Monday, None
236, Arvada, Colorado, 120492, 106433, +13.21%, 38.6, 100.0, 3043, 1175, 39°50′01″N 105°09′01″W, 39.8337°N 105.1503°W, 39.8337 -105.1503, 80001-80007 and 80403 , 1698.9552, NNW, 53, True, A slight chance of showers and thunderstorms before 11am then a chance of showers and thunderstorms between 11am and noon then a chance of showers and thunderstorms between noon and 2pm then showers and thunderstorms. Mostly cloudy. High near 53 with temperatures falling to around 49 in the afternoon. North northwest wind 8 to 14 mph with gusts as high as 21 mph. Chance of precipitation is 80%. New rainfall amounts between a tenth and quarter of an inch possible., Chance Showers And Thunderstorms, 8 to 14 mph, 2019-05-28T09:00:00-06:00, 1, 2019-05-28T18:00:00-06:00, Today, falling, NW, 38, False, Showers and thunderstorms before 5am. Cloudy with a low around 38. Northwest wind 2 to 16 mph with gusts as high as 24 mph. Chance of precipitation is 80%. New rainfall amounts less than a tenth of an inch possible., Showers And Thunderstorms, 2 to 16 mph, 2019-05-28T18:00:00-06:00, 2, 2019-05-29T06:00:00-06:00, Tonight, None, NNW, 53, True, A slight chance of rain showers before noon then a slight chance of showers and thunderstorms. Mostly cloudy with a high near 53. North northwest wind 3 to 8 mph. Chance of precipitation is 20%., Slight Chance Rain Showers then Slight Chance Showers And Thunderstorms, 3 to 8 mph, 2019-05-29T06:00:00-06:00, 3, 2019-05-29T18:00:00-06:00, Wednesday, None, WNW, 39, False, A slight chance of showers and thunderstorms before midnight. Mostly cloudy with a low around 39. West northwest wind 3 to 8 mph. Chance of precipitation is 20%., Slight Chance Showers And Thunderstorms then Mostly Cloudy, 3 to 8 mph, 2019-05-29T18:00:00-06:00, 4, 2019-05-30T06:00:00-06:00, Wednesday Night, None, N, 64, True, A slight chance of showers and thunderstorms after noon. Partly sunny with a high near 64. North wind around 5 mph. Chance of precipitation is 20%., Partly Sunny then Slight Chance Showers And Thunderstorms, 5 mph, 2019-05-30T06:00:00-06:00, 5, 2019-05-30T18:00:00-06:00, Thursday, None, SSW, 42, False, A slight chance of showers and thunderstorms before 9pm. Mostly cloudy with a low around 42., Slight Chance Showers And Thunderstorms then Mostly Cloudy, 5 mph, 2019-05-30T18:00:00-06:00, 6, 2019-05-31T06:00:00-06:00, Thursday Night, None, ESE, 73, True, Mostly sunny with a high near 73., Mostly Sunny, 5 mph, 2019-05-31T06:00:00-06:00, 7, 2019-05-31T18:00:00-06:00, Friday, None, WNW, 47, False, Partly cloudy with a low around 47., Partly Cloudy, 5 mph, 2019-05-31T18:00:00-06:00, 8, 2019-06-01T06:00:00-06:00, Friday Night, None, S, 77, True, Mostly sunny with a high near 77., Mostly Sunny, 6 mph, 2019-06-01T06:00:00-06:00, 9, 2019-06-01T18:00:00-06:00, Saturday, None, SSE, 49, False, Partly cloudy with a low around 49., Partly Cloudy, 6 mph, 2019-06-01T18:00:00-06:00, 10, 2019-06-02T06:00:00-06:00, Saturday Night, None, S, 80, True, A slight chance of showers and thunderstorms after noon. Mostly sunny with a high near 80., Mostly Sunny then Slight Chance Showers And Thunderstorms, 5 mph, 2019-06-02T06:00:00-06:00, 11, 2019-06-02T18:00:00-06:00, Sunday, None, SSW, 50, False, Partly cloudy with a low around 50., Partly Cloudy, 7 mph, 2019-06-02T18:00:00-06:00, 12, 2019-06-03T06:00:00-06:00, Sunday Night, None, SW, 80, True, Mostly sunny with a high near 80., Mostly Sunny, 7 mph, 2019-06-03T06:00:00-06:00, 13, 2019-06-03T18:00:00-06:00, Monday, None
237, Cambridge, Massachusetts, 118977, 105162, +13.14%, 6.4, 16.6, 17289, 6675, 42°22′34″N 71°07′07″W, 42.3760°N 71.1187°W, 42.3760 -71.1187, 02138  02139  02140  02141  02142, 0.9144000000000001, SE, 57, True, Widespread rain showers before 5pm then widespread rain showers and patchy fog. Cloudy. High near 57 with temperatures falling to around 51 in the afternoon. Southeast wind around 9 mph with gusts as high as 21 mph. Chance of precipitation is 100%. New rainfall amounts between a quarter and half of an inch possible., Widespread Rain Showers, 9 mph, 2019-05-28T11:00:00-04:00, 1, 2019-05-28T18:00:00-04:00, Today, falling, E, 50, False, Widespread rain showers and patchy fog before 10pm then patchy fog and a chance of showers and thunderstorms between 10pm and 11pm then patchy fog and scattered rain showers. Some of the storms could produce heavy rain. Cloudy with a low around 50. East wind 5 to 8 mph. Chance of precipitation is 100%. New rainfall amounts between a quarter and half of an inch possible., Patchy Fog, 5 to 8 mph, 2019-05-28T18:00:00-04:00, 2, 2019-05-29T06:00:00-04:00, Tonight, None, NE, 62, True, Patchy fog before 8am. Mostly cloudy with a high near 62. Northeast wind around 8 mph., Patchy Fog then Mostly Cloudy, 8 mph, 2019-05-29T06:00:00-04:00, 3, 2019-05-29T18:00:00-04:00, Wednesday, None, SE, 52, False, A chance of rain showers after 7pm. Mostly cloudy with a low around 52. Southeast wind around 7 mph. Chance of precipitation is 40%. New rainfall amounts between a tenth and quarter of an inch possible., Chance Rain Showers, 7 mph, 2019-05-29T18:00:00-04:00, 4, 2019-05-30T06:00:00-04:00, Wednesday Night, None, SE, 69, True, A chance of rain showers. Mostly cloudy with a high near 69. Southeast wind around 7 mph. Chance of precipitation is 40%., Chance Rain Showers, 7 mph, 2019-05-30T06:00:00-04:00, 5, 2019-05-30T18:00:00-04:00, Thursday, None, SW, 57, False, Rain showers likely. Mostly cloudy with a low around 57. Southwest wind around 9 mph. Chance of precipitation is 60%., Rain Showers Likely, 9 mph, 2019-05-30T18:00:00-04:00, 6, 2019-05-31T06:00:00-04:00, Thursday Night, None, NW, 72, True, A chance of rain showers before noon. Mostly sunny with a high near 72. Northwest wind around 10 mph. Chance of precipitation is 30%., Chance Rain Showers then Mostly Sunny, 10 mph, 2019-05-31T06:00:00-04:00, 7, 2019-05-31T18:00:00-04:00, Friday, None, W, 52, False, Mostly clear with a low around 52. West wind 3 to 10 mph., Mostly Clear, 3 to 10 mph, 2019-05-31T18:00:00-04:00, 8, 2019-06-01T06:00:00-04:00, Friday Night, None, SW, 75, True, Mostly sunny with a high near 75. Southwest wind 6 to 10 mph., Mostly Sunny, 6 to 10 mph, 2019-06-01T06:00:00-04:00, 9, 2019-06-01T18:00:00-04:00, Saturday, None, SW, 58, False, A slight chance of rain showers between midnight and 5am then a chance of showers and thunderstorms. Mostly cloudy with a low around 58. Southwest wind 8 to 12 mph. Chance of precipitation is 30%., Mostly Cloudy then Chance Showers And Thunderstorms, 8 to 12 mph, 2019-06-01T18:00:00-04:00, 10, 2019-06-02T06:00:00-04:00, Saturday Night, None, SW, 75, True, A chance of showers and thunderstorms. Mostly cloudy with a high near 75. Southwest wind around 10 mph. Chance of precipitation is 30%., Chance Showers And Thunderstorms, 10 mph, 2019-06-02T06:00:00-04:00, 11, 2019-06-02T18:00:00-04:00, Sunday, None, W, 56, False, A chance of showers and thunderstorms. Mostly cloudy with a low around 56. West wind around 9 mph. Chance of precipitation is 30%., Chance Showers And Thunderstorms, 9 mph, 2019-06-02T18:00:00-04:00, 12, 2019-06-03T06:00:00-04:00, Sunday Night, None, W, 71, True, A slight chance of rain showers. Mostly sunny with a high near 71. West wind around 9 mph., Slight Chance Rain Showers, 9 mph, 2019-06-03T06:00:00-04:00, 13, 2019-06-03T18:00:00-04:00, Monday, None
238, Sugar Land, Texas, 118600, 78817, +50.48%, 34.0, 88.1, 3488, 1347, 29°35′58″N 95°36′51″W, 29.5994°N 95.6142°W, 29.5994 -95.6142, 77478-79  77487  77496  and 77498, 21.945600000000002, S, 91, True, A slight chance of rain showers. Mostly sunny with a high near 91. South wind around 15 mph with gusts as high as 25 mph. Chance of precipitation is 20%., Slight Chance Rain Showers, 15 mph, 2019-05-28T10:00:00-05:00, 1, 2019-05-28T18:00:00-05:00, Today, None, SE, 75, False, A slight chance of rain showers after midnight. Mostly cloudy with a low around 75. Southeast wind 10 to 15 mph with gusts as high as 25 mph. Chance of precipitation is 20%., Mostly Cloudy then Slight Chance Rain Showers, 10 to 15 mph, 2019-05-28T18:00:00-05:00, 2, 2019-05-29T06:00:00-05:00, Tonight, None, SE, 90, True, A slight chance of rain showers before 7am then a slight chance of showers and thunderstorms. Mostly sunny with a high near 90. Southeast wind 10 to 15 mph with gusts as high as 25 mph. Chance of precipitation is 20%., Slight Chance Rain Showers then Slight Chance Showers And Thunderstorms, 10 to 15 mph, 2019-05-29T06:00:00-05:00, 3, 2019-05-29T18:00:00-05:00, Wednesday, None, SE, 77, False, A chance of showers and thunderstorms. Mostly cloudy with a low around 77. Southeast wind 5 to 15 mph with gusts as high as 25 mph. Chance of precipitation is 30%., Chance Showers And Thunderstorms, 5 to 15 mph, 2019-05-29T18:00:00-05:00, 4, 2019-05-30T06:00:00-05:00, Wednesday Night, None, S, 89, True, A chance of showers and thunderstorms. Mostly cloudy with a high near 89. South wind 5 to 10 mph. Chance of precipitation is 50%., Chance Showers And Thunderstorms, 5 to 10 mph, 2019-05-30T06:00:00-05:00, 5, 2019-05-30T18:00:00-05:00, Thursday, None, SE, 75, False, A chance of showers and thunderstorms. Mostly cloudy with a low around 75. Chance of precipitation is 50%., Chance Showers And Thunderstorms, 5 mph, 2019-05-30T18:00:00-05:00, 6, 2019-05-31T06:00:00-05:00, Thursday Night, None, E, 90, True, A chance of showers and thunderstorms. Partly sunny with a high near 90. Chance of precipitation is 30%., Chance Showers And Thunderstorms, 5 mph, 2019-05-31T06:00:00-05:00, 7, 2019-05-31T18:00:00-05:00, Friday, None, SE, 75, False, A chance of showers and thunderstorms before 7pm. Partly cloudy with a low around 75. Chance of precipitation is 30%., Chance Showers And Thunderstorms then Partly Cloudy, 0 to 5 mph, 2019-05-31T18:00:00-05:00, 8, 2019-06-01T06:00:00-05:00, Friday Night, None, SE, 90, True, A slight chance of showers and thunderstorms after 7am. Mostly sunny with a high near 90. Chance of precipitation is 20%., Slight Chance Showers And Thunderstorms, 0 to 5 mph, 2019-06-01T06:00:00-05:00, 9, 2019-06-01T18:00:00-05:00, Saturday, None, S, 74, False, A slight chance of showers and thunderstorms before 7pm. Mostly clear with a low around 74. Chance of precipitation is 20%., Slight Chance Showers And Thunderstorms then Mostly Clear, 5 mph, 2019-06-01T18:00:00-05:00, 10, 2019-06-02T06:00:00-05:00, Saturday Night, None, S, 91, True, A slight chance of showers and thunderstorms after 7am. Mostly sunny with a high near 91. Chance of precipitation is 20%., Slight Chance Showers And Thunderstorms, 0 to 5 mph, 2019-06-02T06:00:00-05:00, 11, 2019-06-02T18:00:00-05:00, Sunday, None, S, 75, False, A slight chance of showers and thunderstorms before 7pm. Partly cloudy with a low around 75. Chance of precipitation is 20%., Slight Chance Showers And Thunderstorms then Partly Cloudy, 5 to 10 mph, 2019-06-02T18:00:00-05:00, 12, 2019-06-03T06:00:00-05:00, Sunday Night, None, S, 92, True, Mostly sunny with a high near 92., Mostly Sunny, 0 to 10 mph, 2019-06-03T06:00:00-05:00, 13, 2019-06-03T18:00:00-05:00, Monday, None
239, Beaumont, Texas, 118428, 118296, +0.11%, 82.1, 212.6, 1441, 556, 30°05′06″N 94°08′43″W, 30.0849°N 94.1453°W, 30.0849 -94.1453, 77701–77710  77713  77720  77725  77726, 7.010400000000001, S, 89, True, A chance of showers and thunderstorms before 1pm then a chance of showers and thunderstorms between 1pm and 4pm. Partly sunny with a high near 89. Heat index values as high as 97. South wind 10 to 15 mph. Chance of precipitation is 30%. New rainfall amounts less than a tenth of an inch possible., Chance Showers And Thunderstorms, 10 to 15 mph, 2019-05-28T10:00:00-05:00, 1, 2019-05-28T18:00:00-05:00, Today, None, S, 75, False, Mostly cloudy with a low around 75. South wind around 10 mph. New rainfall amounts less than a tenth of an inch possible., Mostly Cloudy, 10 mph, 2019-05-28T18:00:00-05:00, 2, 2019-05-29T06:00:00-05:00, Tonight, None, S, 89, True, Mostly sunny with a high near 89. South wind 10 to 15 mph with gusts as high as 20 mph., Mostly Sunny, 10 to 15 mph, 2019-05-29T06:00:00-05:00, 3, 2019-05-29T18:00:00-05:00, Wednesday, None, SE, 74, False, A slight chance of rain showers after 1am. Partly cloudy with a low around 74. Southeast wind 5 to 15 mph. Chance of precipitation is 20%., Partly Cloudy then Slight Chance Rain Showers, 5 to 15 mph, 2019-05-29T18:00:00-05:00, 4, 2019-05-30T06:00:00-05:00, Wednesday Night, None, S, 89, True, A slight chance of rain showers before 7am then a chance of showers and thunderstorms. Partly sunny with a high near 89. South wind 5 to 10 mph. Chance of precipitation is 40%., Chance Showers And Thunderstorms, 5 to 10 mph, 2019-05-30T06:00:00-05:00, 5, 2019-05-30T18:00:00-05:00, Thursday, None, SE, 74, False, A chance of showers and thunderstorms. Mostly cloudy with a low around 74. Southeast wind 0 to 5 mph. Chance of precipitation is 40%., Chance Showers And Thunderstorms, 0 to 5 mph, 2019-05-30T18:00:00-05:00, 6, 2019-05-31T06:00:00-05:00, Thursday Night, None, E, 91, True, A chance of showers and thunderstorms. Partly sunny with a high near 91. East wind 0 to 5 mph. Chance of precipitation is 30%., Chance Showers And Thunderstorms, 0 to 5 mph, 2019-05-31T06:00:00-05:00, 7, 2019-05-31T18:00:00-05:00, Friday, None, E, 73, False, A chance of showers and thunderstorms before 7pm. Partly cloudy with a low around 73. East wind 0 to 5 mph. Chance of precipitation is 30%., Chance Showers And Thunderstorms then Partly Cloudy, 0 to 5 mph, 2019-05-31T18:00:00-05:00, 8, 2019-06-01T06:00:00-05:00, Friday Night, None, E, 91, True, A slight chance of showers and thunderstorms after 1pm. Mostly sunny with a high near 91. East wind 0 to 5 mph. Chance of precipitation is 20%., Mostly Sunny then Slight Chance Showers And Thunderstorms, 0 to 5 mph, 2019-06-01T06:00:00-05:00, 9, 2019-06-01T18:00:00-05:00, Saturday, None, SW, 73, False, A slight chance of showers and thunderstorms before 7pm. Mostly clear with a low around 73. Chance of precipitation is 20%., Slight Chance Showers And Thunderstorms then Mostly Clear, 0 to 5 mph, 2019-06-01T18:00:00-05:00, 10, 2019-06-02T06:00:00-05:00, Saturday Night, None, E, 92, True, A slight chance of showers and thunderstorms after 1pm. Mostly sunny with a high near 92. Chance of precipitation is 20%., Mostly Sunny then Slight Chance Showers And Thunderstorms, 0 to 5 mph, 2019-06-02T06:00:00-05:00, 11, 2019-06-02T18:00:00-05:00, Sunday, None, SW, 74, False, A slight chance of showers and thunderstorms before 7pm. Partly cloudy with a low around 74. Chance of precipitation is 20%., Slight Chance Showers And Thunderstorms then Partly Cloudy, 0 to 5 mph, 2019-06-02T18:00:00-05:00, 12, 2019-06-03T06:00:00-05:00, Sunday Night, None, SW, 92, True, Mostly sunny with a high near 92., Mostly Sunny, 0 to 5 mph, 2019-06-03T06:00:00-05:00, 13, 2019-06-03T18:00:00-05:00, Monday, None
240, Lansing, Michigan, 118427, 114297, +3.61%, 39.1, 101.3, 2967, 1146, 42°42′51″N 84°33′33″W, 42.7143°N 84.5593°W, 42.7143 -84.5593, 48901-48980 , 260.9088, WNW, 66, True, Mostly cloudy with a high near 66. West northwest wind 8 to 12 mph with gusts as high as 21 mph., Mostly Cloudy, 8 to 12 mph, 2019-05-28T11:00:00-04:00, 1, 2019-05-28T18:00:00-04:00, Today, None, NNE, 51, False, Rain showers likely after 2am. Mostly cloudy with a low around 51. North northeast wind 5 to 8 mph. Chance of precipitation is 60%. New rainfall amounts less than a tenth of an inch possible., Mostly Cloudy then Rain Showers Likely, 5 to 8 mph, 2019-05-28T18:00:00-04:00, 2, 2019-05-29T06:00:00-04:00, Tonight, None, ESE, 69, True, Rain showers likely. Mostly cloudy with a high near 69. East southeast wind around 5 mph. Chance of precipitation is 60%. New rainfall amounts between a tenth and quarter of an inch possible., Rain Showers Likely, 5 mph, 2019-05-29T06:00:00-04:00, 3, 2019-05-29T18:00:00-04:00, Wednesday, None, WSW, 56, False, A chance of rain showers. Mostly cloudy with a low around 56. West southwest wind around 5 mph. Chance of precipitation is 30%. New rainfall amounts less than a tenth of an inch possible., Chance Rain Showers, 5 mph, 2019-05-29T18:00:00-04:00, 4, 2019-05-30T06:00:00-04:00, Wednesday Night, None, WSW, 68, True, A chance of rain showers. Cloudy with a high near 68. West southwest wind 2 to 7 mph. Chance of precipitation is 50%., Chance Rain Showers, 2 to 7 mph, 2019-05-30T06:00:00-04:00, 5, 2019-05-30T18:00:00-04:00, Thursday, None, NW, 47, False, A chance of rain showers before 8pm. Mostly cloudy with a low around 47. Chance of precipitation is 50%., Chance Rain Showers then Mostly Cloudy, 7 mph, 2019-05-30T18:00:00-04:00, 6, 2019-05-31T06:00:00-04:00, Thursday Night, None, NW, 70, True, Mostly sunny with a high near 70., Mostly Sunny, 6 mph, 2019-05-31T06:00:00-04:00, 7, 2019-05-31T18:00:00-04:00, Friday, None, WSW, 54, False, A slight chance of rain showers after 2am. Partly cloudy with a low around 54., Partly Cloudy then Slight Chance Rain Showers, 8 mph, 2019-05-31T18:00:00-04:00, 8, 2019-06-01T06:00:00-04:00, Friday Night, None, W, 73, True, A slight chance of rain showers before 2pm then showers and thunderstorms likely. Partly sunny with a high near 73., Showers And Thunderstorms Likely, 8 to 12 mph, 2019-06-01T06:00:00-04:00, 9, 2019-06-01T18:00:00-04:00, Saturday, None, NW, 52, False, Showers and thunderstorms likely before 2am. Mostly cloudy with a low around 52., Showers And Thunderstorms Likely, 5 to 9 mph, 2019-06-01T18:00:00-04:00, 10, 2019-06-02T06:00:00-04:00, Saturday Night, None, N, 67, True, Mostly sunny with a high near 67., Mostly Sunny, 5 to 9 mph, 2019-06-02T06:00:00-04:00, 11, 2019-06-02T18:00:00-04:00, Sunday, None, NNW, 48, False, Partly cloudy with a low around 48., Partly Cloudy, 5 to 9 mph, 2019-06-02T18:00:00-04:00, 12, 2019-06-03T06:00:00-04:00, Sunday Night, None, NW, 68, True, Sunny with a high near 68., Sunny, 5 to 9 mph, 2019-06-03T06:00:00-04:00, 13, 2019-06-03T18:00:00-04:00, Monday, None
